{
  "case_id": "deterministic-log-demo",
  "status": "demonstration",
  "family": "demonstration-log",
  "ecosystem": "language-neutral",
  "tool": "demo-build-log",
  "origin_kind": "generated-first-party",
  "capture_mode": "reproducible-command",
  "rtk_mode": "pipe-filter",
  "snapshot_policy": "raw-and-rtk",
  "provenance_path": "provenance.json",
  "capture_recipe_path": "capture-recipe.json",
  "evidence_map_path": "evidence-map.json",
  "snapshot_manifest_path": "snapshot-manifest.json",
  "markers": [
    "NON-BENCHMARK",
    "NON-GATING",
    "NOT PART OF THE 48 BASE CASES",
    "NOT PUBLIC-DEVELOPMENT",
    "NOT PUBLIC-VALIDATION",
    "NOT HELD-OUT"
  ],
  "tags": ["demo", "plumbing"],
  "notes": "Plumbing demonstration only. This is NOT benchmark evidence and can never become a benchmark case by renaming or retagging."
}
